"id","text"
"1650376826","BP Posts Quarterly Loss Amid Oil Price Rout Oil Major Will Cut Capital and Exploratory Budget by Nearly 20 At least two dozen US independent oil producers have announced plans to curb capital spending this year by nearly 24 billion dollars compared with last year's budgets according to a review of company records by The Wall Street Journal   LONDONBP PLC on Tuesday joined a raft of oil companies big and small slashing their budgets for finding and tapping new sources of crude offering a pessimistic outlook on a day it reported a net loss for the latest financial quarterThe London-based company which is still facing up to 137 billion in US penalties from its 2010 Gulf of Mexico spill said it would cut its capital and exploratory budget by nearly 20 down to 20 billionThe announcement came as BP became the only so-called super-major oil company in the red in the fourth quarter a 969 million replacement-cost loss caused in part by a more than 3 billion downgrade in the value of some of its reservesBP CEO Bob Dudley gave a darker assessment of the future than his oil rivals have saying US shale production and low oil prices are a structural shift that is forcing him to reset the whole cost base of the companyThe outlook for oil prices is clearly much weaker than anyone anticipated he said I do think we're in for at minimum a year and probably several years of lower pricesBP is the latest producer to grapple with plunging oil prices by cutting capital expenses walking a line between making short-term cost cuts and the need to invest in long-term projects that will produce crude in years to comeAt least two dozen US independent oil producers have announced plans to curb capital spending this year by nearly 24 billion dollars compared with last year's budgets according to a review of company records by The Wall Street Journal Additional cuts are expected over the next several weeks as big shale players including EOG Resources Inc and Anadarko Petroleum Corp outline their 2015 spending strategiesAnd BP's decision follows super-major rivals Chevron Corp and Royal Dutch Shell PLC in slashing planned capital expenses by billions of dollarsThe cutbacks come after years of high spending on giant projects around the globe With oil near 100 a barrel companies competing for access to drill rigs and contractors drove up development costs and sent giant projects over budget in far-flung places like Papua New GuineaNow oil prices are hovering between 50 and 60 a barrel The situation has benefited American consumers who have enjoyed 2 a gallon gasoline for the first time in a decade but it is below the break-even point for many new oil-drilling projectsBP's gloomy quarterly report didn't scare off investors who sent the stock up nearly 4 in London trading TuesdayThe slashed spending by producers has helped fuel the recent oil-price rally with some betting the cuts will bring the global market back into balance Brent the global benchmark and WTI the US price marker have both gained more than 15 since ThursdayBut the risks of pulling back too far on new oil fields were noted by some analysts and investorsBP last year replaced only 62 of the oil and gas it pumped with new reserves and Shell replaced just 26 For both companies that is the lowest amount in a decade according to data from analysts at Oppenheimer Mr Dudley said Tuesday that the replacement ratios are lumpy year to year and the fluctuations aren't a concernYou'll get Brownie points from the stock market for slashing your spending in the short term but in the long term you have to be concerned about your long-term prospects said Ivor Pether a portfolio manager with Royal London Asset Management which owns Shell and BP stockThe spending cuts and a commitment to paying dividends were heartening to investors Mr Pether said but he added that investors must ask how they are protecting the long-term dividend stability which only comes from delivering new projects to replace the ones that run offDevelopment costs are dropping with the oil price Now said Oppenheimer analyst Fadel Gheit would be the time to invest in long-term projects Instead companies facing investor pressure are cutting back when they could invest at low rates on projects that could be lucrative if prices rebound years down the roadMr Dudley said the company is reviewing for a second time a delayed offshore project in the Gulf of Mexico called Mad Dog 2 in an effort to find ways to cut costs The company also struck a deal to partner with Chevron on some Gulf projects that could make them less costly for BP Mr Dudley saidAnother British energy company BG Group PLC said it would cancel or delay projects in 2015 and cut capital spending by roughly a third to about 6 billion to 7 billion after writing down nearly 9 billion in assets and reporting a net loss of 5 billion for the 2014 fourth quarter In the last six months the world has changed said BG Executive Chairman Andrew Gould on a conference call After four years of prices above 100 we're now operating above 50 a barrelShell last week sounded a less bearish note Its chief executive said the company would cut some 15 billion of planned capital spending over the next few years but executives said they were confident that oil prices would rebound in coming years Chevron said last week it would cut capital spending this year by 13 from 2014Since its 2010 Gulf of Mexico explosion and spill BP has faced investor pressure to maintain dividends which Mr Dudley called a financial priority The company has shrunk since the spill selling more than 40 billion in assets to pay for legal and cleanup costs Even as it announced cost cuts Tuesday Mr Dudley said BP would raise its dividendThe asset sales since 2010 reduced BP's production by about 25 between the spill and the end of 2013 but the company said in December that its head count rose over that period BP said it would book a 1 billion restructuring charge as it tries to cut costs through layoffs and other measuresBP also lowered the value of reserves in places such as the North Sea and Angola which it has relied on for some of its highest profit margins in recent yearsFor the full year BP reported a replacement-cost profita figure that strips out inventory changes and is similar to the net income that US companies reportof 807 billion compared with 2361 billion for 2013BP's net loss for the quarter was 441 billion compared with a profit of 104 billion in the same period last year on revenue down 21 at 74 billionNet profit for the year fell to 378 billion from 2345 billion with revenue falling 67 to 35357 billionBP's earnings only capture a portion of the recent oil-price decline since much of it happened after the quarter closed the price for benchmark Brent crude averaged about 77 a barrel in the fourth quarterErin Ailworth Daniel Gilbert Selina Williams and Georgi Kantchev contributed to this articleWrite to Justin Scheck atCredit By Justin ScheckSubject Prices Investments Dividends Profit margins Petroleum industry Net losses Cost reduction Executives Capital expenditures Budgets Corporate profits Oil reserves Crude oil pricesBusiness indexing term Subject Dividends Profit margins Petroleum industry Net losses Cost reduction Executives Capital expenditures Budgets Corporate profits Corporation BP PLCLocation United StatesUSPeople Dudley BobCompany organization Name EOG Resources Inc NAICS 211120 213112 Name Royal Dutch Shell PLC NAICS 213112 221210 324110 Name Anadarko Petroleum Corp NAICS 211120"
"889154322","Conoco Tries to Fuel More Natural-Gas Use Cheap natural gas prices mean savings for consumers but they don't translate into profits for gas producers who are struggling to break even with prices hovering around 4 per thousand cubic feet Since peaking in 2008 the price of natural gas has declined by about 70 ConocoPhillips is launching a campaign for natural gas to play a greater role in meeting US energy needs even as it plays a diminished role in the energy giant's portfolio because of weak prices driven by a supply glutWith the initiative Power in Cooperation Houston-based Conoco is staking out a position on a major domestic energy issue touting the country's massive natural-gas resources as a job-creating clean-burning energy source while trying to address concerns about its impact on the environmentNo other energy source can match the ability of natural gas to deliver energy quickly reliably cleanly and affordably and thus drive economic growth and job creation the company says on the campaign's website Conoco was due to touch off the campaign Wednesday with a speech by its chief executive to the Detroit Economics Club The company will continue to make its case for gas with advertisements and executives will be addressing the topic in other citiesBut the initiative perhaps inadvertently also highlights a tension between the company's long-term optimism about natural gas and its pessimism regarding the fuel's current cheap market price Conoco and other major gas producers want the country to use more gas but right now they want to produce less of itWe are reducing our exposure through less capital investment towards natural gas in North America Jim Mulva Conoco's chief executive said last week at an energy conferenceCheap natural gas prices mean savings for consumers but they don't translate into profits for gas producers who are struggling to break even with prices hovering around 4 per thousand cubic feet Since peaking in 2008 the price of natural gas has declined by about 70 Conoco and other major operators have been shifting their spending away from gas to focus on more-lucrative oil They stand to benefit from greater natural-gas consumption as urged by the campaign That would spur demand and lift pricesIn recent years energy companies have found a way to extract vast volumes of natural gas from a type of rock called shale a source that hadn't been considered commercially viable In the span of a few years in the last decade companies glutted the market with gas and all but erased their own profit marginsIn August the US Geological Survey estimated that the Marcellus Shale a layer of rock that stretches across Pennsylvania and into New York and West Virginia holds 84 trillion cubic feet of undiscovered gas that can be recovered with existing technology42 times the amount it estimated in 2002Analysts project that the supply will keep a lid on what historically have been volatile prices for natural gasCompanies like Chesapeake Energy Corp and EOG Resources Inc which helped pioneer shale gas are concentrating their spending on oil The number of rigs drilling for oil has increased nearly 60 while those drilling for gas has declined 9 according to data from oil-field-services firm Baker Hughes IncExxon Mobil Corp and Chevron Corp the two largest US energy companies were late to get into shale gas but have been spending billions to acquire gas-producing acreage and companies Earlier this year Exxon launched its own campaign to tout the benefits of natural gas and push back against criticism of hydraulic fracturing a method of recovering more gas by injecting a high-pressure mixture of water sand and chemicals into a well The process has drawn environmental opposition and regulatory scrutiny largely because of questions surrounding its impact on drinking water and air qualityConoco had been producing much more gas as a portion of its portfolio than Exxon and Chevron thanks to gas assets in North America it acquired with a 35 billion purchase of Burlington Resources in 2005 While it is shedding some of those assets the company still sees a long-term upside to gasMr Mulva in a July interview called natural gas a superior fuel but said he didn't expect prices to increase in the near future But I think longer term we're going to see it used more for power generation he said predicting greater demand would lift prices between 5 and 7 per thousand cubic feetBlake Fernandez an analyst for Howard Weil said Conoco still stands to benefit by promoting natural gas even as it gets rid of inferior gas-producing assets Should natural-gas prices recover they could really increase their capital program and capture that benefitCredit By Daniel GilbertSubject Petroleum industry Energy industry Natural gas pricesBusiness indexing term Subject Petroleum industry Energy industry Natural gas prices Industry 22111 ‎ Electric Power GenerationLocation United StatesUSClassification 22111 Electric Power Generation"
"1880041550","Mexican Inflation Near Eight-Year High in Early March Data supports expectations that the Bank of Mexico will raise interest rates further None available MEXICO CITYMexican inflation accelerated in early March to its fastest pace in nearly eight years as a weaker currency continued to push up goods prices supporting expectations that the Bank of Mexico will raise interest rates furtherThe consumer-price index rose 035 in the first two weeks of March pushing the annual rate up to 529 from 486 at the end of February the National Statistics Institute said Thursday It was the highest annual rate since July 2009Core CPI which excludes energy and fresh fruit and vegetables rose 031 for an annual rate of 432 compared with 426 in FebruaryNonfood items affected by a weaker Mexican peso such as imported products and other manufactured goods rose 05 at the start of the month and were up 521 in the past year Processed food prices rose 037 for an annual increase of 637Energy costs slipped 022 in the first half of March but were up 176 from a year before following sharp gasoline and diesel price increases in JanuaryBanks polled this week by Citibanamex were almost unanimous in expecting the Bank of Mexico to raise its overnight interest-rate target again next week as a result of the continued rise in the inflation rate and the Federal Reserve's rate increase earlier this month More than half of the banks expect the rate to rise by a quarter percentage point to 65 a slower pace of tightening after six consecutive half-point increasesBank of Mexico Gov Agustín Carstens addressing the Mexican bankers convention late Wednesday said the central bank's 325 percentage points in interest-rate increases since December 2015 has undoubtedly smoothed out the pass-through from the peso's depreciation to general price levelsMr Carstens also said that the peso has rebounded sharply from the record-low at more than 22 pesos to the US dollar in mid-JanuaryThis correction will help reduce the rate of inflation facilitating a return toward the target he saidThe central bank expects that inflation will remain above its 24 band this year and move back to the 3 target at the end of 2018Write to Anthony Harrup at anthonyharrup wsjcomCredit By Anthony HarrupSubject Central banks Interest rates Consumer Price IndexBusiness indexing term Subject Central banks Interest rates Consumer Price Index Industry 52111 ‎ Monetary Authorities-Central BankLocation United StatesUSCompany organization Name Bank of Mexico NAICS 522110Classification 52111 Monetary Authorities-Central Bank"
"2027596861","Canada Inflation Accelerates in March Consumer prices post biggest year-over-year increase since late 2014 None available OTTAWACanada's inflation picked up steam in March recording the largest annual increase in prices since late 2014 in another sign the economy is operating close to capacityGasoline and restaurant food were among the main contributors to the advanceCanada's consumer-price index rose 23 on a one-year basis in March Statistics Canada said Friday following a 22 increase in February The March result was just shy of expectations for a 24 advance according to economists at Royal Bank of CanadaOn a month-over-month basis prices rose 03 in March On a seasonally adjusted basis monthly prices increased 01Underlying or core inflation remained relatively unchanged in March compared with the previous month Annual underlying prices rose in a range from 19 to 21 based on the three preferred gauges used by the Bank of Canada for an average of 20 The average of the three core measures has steadily climbed after hitting a low of 13 in MayThe Bank of Canada sets its interest-rate policy to achieve and maintain 2 inflation Should inflation start running hotter than 2 for an extended period the central bank could raise rates to cool spendingBank of Canada left its benchmark rate unchanged this week at 125 following its latest policy meeting Governor Stephen Poloz said the Canadian economy is operating close to capacity with low unemployment and inflation on target and that signals higher rates will be warranted over timeHe cautioned though low rates were still needed to support growth given a series of headwinds the economy facessome of which are related to US trade-policy uncertaintyThe central bank expects inflation to remain modestly above 2 for the bulk of this year and return to about 2 in 2019 The last time Canada experienced annual average inflation of 2 was in 2014In the March report Statistics Canada said higher gasoline prices at the pump were a significant contributor to inflation Gasoline prices rose 171 on a one-year basis Excluding gasoline Canadian annual inflation was 18Food prices rose 17 on a one-year basis but that was in part driven by a 44 advance in meals purchased at restaurants Restaurant meal prices in Canada have climbed due to the impact of higher minimum wages set by the provinces of Ontario and AlbertaWrite to Paul Vieira at paulvieira wsjcomCredit By Paul VieiraSubject Gasoline prices Inflation Central banks Consumer Price IndexBusiness indexing term Subject Gasoline prices Inflation Central banks Consumer Price Index Industry 52111 ‎ Monetary Authorities-Central BankLocation United StatesUS CanadaPeople Poloz StephenCompany organization Name Bank of Canada NAICS 521110 Name Statistics Canada NAICS 926110 Name Royal Bank of Canada NAICS 522110Classification 52111 Monetary Authorities-Central Bank"
"2377046166","Breakdown of Bedrock Relationship in Markets Tests Investors Nerves The late-week selloff in Treasurys concerns many accustomed to bond-price gains when stocks fall None available Investors wading back into tumultuous markets this week face an unusual challenge playing unruly stock indexes while cracks are visible in the world's largest market for interest ratesThe Dow industrials dropped 10 last week even after posting their largest gain since 2008 on Friday with a 94 advance Friday's gains came alongside increases in the price of oil which suffered its steepest weekly percentage loss since 2008—a sign of normal market functioningBut many traders and portfolio analysts remain cautious thanks to signs of underlying distress Gold normally a strong performer in times of stress suffered its worst week since 2011 dropping 93 and wiping out all its 2020 gains Silver a more volatile precious metal tumbled 16 and is down 19 for the year And perhaps most troublingly US government bonds took a hammering with the 10-year Treasury yield rising four straight days in its largest such gain since 2009The retreat of these haven assets has attracted the attention of traders bankers and regulators alike The Federal Reserve conducted some of its most extraordinary interventions in years with a plan to temporarily pour 15 trillion into markets and traders said there were signs that balky areas of the bond markets such as those for mortgage securities were trading more healthily FridayYet many investors say they expect volatility will remain the norm and that a full return to stocks won't be in the cards until concerns about Treasury market liquidity margin calls to investors with wrong-way bets and the unwind of leveraged trades can be dismissed with greater convictionOriginally when the market was going down Treasurys were working just fine said Jack Janasiewicz portfolio manager at Natixis Investment Managers Solutions Then that started to break down That's when you just say you know what I'm OK with cashYields rose even as many analysts expect the Federal Reserve to cut its benchmark rate to near zero next week The 10-year Treasury yield hit 0946 Friday up from its record low of 0501 MondayWhile the rise in rates itself isn't large enough to present a problem to companies and other borrowers the spectacle of bond yields rising during a flight-to-safety event unnerved some investors particularly given the sharpness of the bond rally that preceded the selloffOne measure of the sharpness of that rally is evident in the three-month rolling correlations between bonds and the SP 500 using weekly total returns—price gains plus periodic payments such as dividendsSHARE YOUR THOUGHTSHow are you handling anxiety over market turbulence Join the conversation belowGet an early-morning coronavirus briefing each weekday plus a health-news update Fridays Sign up here As of March 3 roughly halfway through the current selloff period the correlation was minus 084 according to Goldman Sachs Group Inc data That was the lowest since January 2015 indicating a near-perfect match between stock rallies and bond selloffs and vice versa Correlations range from minus 1 to 1 with minus 1 meaning two things move opposite and 1 meaning they move in lockstepBut the inverse moves haven't been automatic in the past week and the rolling correlation rose to minus 064 Thursday Traders and investors said much of the Treasury selloff was driven by balance-sheet concerns at banks that sold Treasurys instead of riskier debt whose prices had fallen more while others cited the unwind of some hedge-fund trades made with borrowed money Even so the disruption of one of the most closely watched relationships in all of markets helped to further dent sentiment some portfolio managers saidAt the same time many investors are taking heart at the exceptional actions by the Fed and the growing awareness in other parts of government that the coronavirus pandemic and related economic and markets challenges require immediate attentionSome traders add that the scale of the selloff may offer some opportunity for the bold to purchase securities at lower prices taking advantage of both the growing public anxiety over the virus outbreak and the apparent malfunction of crucial parts of the financial marketsThe Dow is down more than 21 from its highs last month and much of the selloff has seemed so headlong that it couldn't help but be overdone some investors said After the SP 500 peaked Feb 19 the broad stock index the MSCI AC World ex USA stock index the SP GSCI commodity index and the benchmark Treasury yield all declined for seven consecutive trading days—the first such streak in data going back to May 1995 according to Dow Jones Market DataWhile earnings estimates have begun to fall and the Organization for Economic Cooperation and Development predicted global economic growth will slow sharply as governments try to contain the virus the scale of the setback is unclearWe're seeing the market with a for-sale sign on it said Brendan Connaughton managing partner at Catalyst Private WealthHe said his firm is researching and considering investing in a number of stocks it considers undervalued Its potential shopping list includes Salesforcecom Inc Johnson Johnson AbbVie Inc and Amazoncom Inc all of which are well off their highs but have outperformed the broader market in 2020As investors look ahead many say their anxiety is heightened because there isn't a good template to evaluate how the epidemic will change the trajectory for growthWe're all flying completely blind here said Liz Ann Sonders chief investment strategist at Charles SchwabWrite to Karen Langley at karenlangley wsjcomCredit By Karen LangleySubject Investments Anxieties Coronaviruses COVID-19 Stock exchanges Treasuries Securities markets Volatility Interest ratesBusiness indexing term Subject Stock exchanges Treasuries Securities markets Volatility Interest ratesLocation United StatesUSCompany organization Name Goldman Sachs Group Inc NAICS 523110 523120 Name AbbVie Inc NAICS 325411 Name Salesforcecom Inc NAICS 511140 511210 541613 Name Johnson Johnson NAICS 325412 325611 325620 339113 339115 Name Amazoncom Inc NAICS 334310 454110 518210"
